review_id,user_name,review_description,rating,thumbs_up,review_date,developer_response,developer_response_date,appVersion,language_code,country_code,has_response,year
5f1b8d4e-a3c7-49e2-b6f0-8d2a1c9e7f3b ,ricardo_mora ,This thing is so buggy it's embarrassing. Feels like it was made by interns.,2,0,2016-06-25 18:09:00,Issue resolved in v1.4.3 — update now.,2022-11-12 01:27:00,Unknown,en,us,1,2016
b7e2f9c4-1d8a-4c3e-a5f9-6b0d7e2c1a48 ,isabella99 ,"Ads every 10 seconds, even after paying. Greedy and disrespectful to users.",1,0,2016-06-23 15:36:00,Email us at support@appname.com with details.,2022-08-12 23:14:00,Unknown,en,us,1,2016
3a9d6c2f-e4b1-47d9-8f3a-1c5e0b9d7f26 ,jorge_lpz ,Broken since the last update. Can't open half the features. Devs are clueless.,2,0,2016-06-21 12:51:00,Freezing fix coming in next patch.,2018-11-28 08:33:00,Unknown,en,us,1,2016
f1c8a5e3-9d2b-4a7f-b0e6-5c3f1d8a9e74 ,daniela_2705 ,Looks like it hasn't been updated since 2018. Outdated and slow as hell.,2,0,2016-06-19 07:14:00,Search improved in latest version.,2018-11-26 07:09:00,Unknown,en,us,1,2016
0d4e9b7a-c6f2-43a1-9e8d-2b7c5f0a1e39 ,santiago_cr ,I hate this app so much. It ruined my mood every time I tried to use it.,2,0,2016-06-17 04:38:00,Refund issued. Sorry for the confusion.,2018-11-24 05:41:00,Unknown,en,us,1,2016
6a2f8d1c-e5b9-48c3-a1f7-9d0e4b3c2f85 ,emilia_rios ,"Literally zero customer service. Send emails, get ignored. Classic.",3,0,2016-06-15 21:22:00,UI refresh in development.,2018-12-09 23:58:00,Unknown,en,us,1,2016
c5b1e9f4-7a3d-42e6-8c0f-3a9d6e1b7f52 ,gabriel_2003 ,"The notifications are broken, the search is useless, the whole thing is a disaster.",1,0,2016-06-13 19:47:00,Investigating load issues on older devices.,2018-10-09 22:19:00,Unknown,en,us,1,2016
9f3d7a2e-b1c8-4e5f-a9d3-0c6b2f8e1a47 ,lucia_mendez ,Downloaded because of the hype. Biggest disappointment of the year.,3,0,2016-11-06 16:03:00,All reviews are real. Speed improvements underway.,2018-08-09 20:47:00,Unknown,en,us,1,2016
4e8c2f1d-a9e6-47b3-9f0a-5d1c7e3b8a26 ,alejandro_87 ,Forces you to watch ads to do basic things. Feels like punishment.,3,0,2016-09-06 13:29:00,Full redesign coming soon.,2024-05-19 18:22:00,Unknown,en,us,1,2016
1a7d5e9c-f3b2-4c8a-e0f6-9b3d1c6a7f84 ,mariana_vzla ,Keeps freezing my phone. Had to force restart twice already. Deleting now.,2,0,2016-07-06 10:55:00,Forwarded your support feedback to the team.,2024-05-17 13:59:00,Unknown,en,us,1,2016
e2f9c6a3-8d1e-41b7-9c5f-0a4e3d7b2f61 ,nicolas_fer ,The UI is so bad it hurts to look at. Who approved this?,2,0,2016-05-06 08:41:00,Try restarting device or checking connection.,2024-05-15 09:41:00,Unknown,en,us,1,2016
7b4e1d9a-c2f8-48e3-a6b9-5c0f2e1d8a37 ,victoria_lopez ,"Promised free trial, then charged me anyway. Shady practices.",2,0,2016-03-06 06:17:00,Battery optimizations in progress.,2024-05-13 07:18:00,Unknown,en,us,1,2016
d6a3f8e2-9c4b-43d1-8e7a-1f5b0c9d3e72 ,sebastian_12 ,Can't believe this is still on the store. It's practically unusable.,2,0,2016-01-06 23:08:00,Sorry for the bad experience. We'll improve.,2023-10-30 13:58:00,Unknown,en,us,1,2016
3c9e7b1f-a5d2-4e8c-b0f1-6a4d2e9c7b58 ,paola_gomez98 ,Every time I try to log in it fails. Gave up after the 8th try.,1,0,2016-05-30 20:34:00,Freezing fixed in v1.5 — update please.,2023-10-28 13:57:00,Unknown,en,us,1,2016
f8d2c5a7-e1b9-47a3-9f8d-0c3e6b1a5f29 ,fernando_31 ,"Overhyped trash. All flash, no substance. Waste of storage space.",3,0,2016-05-28 17:59:00,Noted your points for future updates.,2023-10-28 13:54:00,Unknown,en,us,1,2016
5e1a9f3c-d7b2-42e6-a1c8-9d4f0b7e3a64 ,valentin_05 ,"Honestly, just uninstalling and moving on. This app deserves 1 star and nothing else.",2,0,2016-05-26 15:22:00,Thanks for the review. Improvements on the way.,2023-10-28 13:51:00,Unknown,en,us,1,2016
a4f7d2e9-8c1a-4b3f-9e6d-2b0c5a8f1e73 ,carolinaaa_ ,"It's okay. Does what it says, but nothing special. Works fine most of the time.",3,0,2016-05-24 12:46:00,Thanks for the feedback! Glad it works most of the time. We're always looking to make it even better.,2023-10-28 13:48:00,Unknown,en,us,1,2016
2b8e6c4d-f9a1-47c3-b5e0-1d9f3c6a8b45 ,david_rdz ,"Average app. Some features are useful, others feel a bit slow. Not bad, not great.",4,0,2016-05-22 10:13:00,Appreciate the honest review. We're working on speeding up some sections — thanks for pointing it out.,2023-10-28 13:45:00,Unknown,en,us,1,2016
9c3a1f7e-d2b8-4e5a-a0f9-6b7d2e1c4f86 ,renata_2000 ,Decent for basic use. I use it occasionally and it gets the job done.,5,0,2016-05-20 07:39:00,Thanks for using the app! Good to know it gets the job done for your needs.,2023-10-28 13:42:00,Unknown,en,us,1,2016
6f5d9b2a-c8e3-41f7-9c4a-0e3b8d1f6a27 ,matias_96 ,"The app is functional. Had a couple of small glitches, but overall it's usable.",3,0,2016-05-18 05:04:00,Thank you. We'll keep an eye on those minor glitches and improve stability in future updates.,2023-10-28 13:39:00,Unknown,en,us,1,2016
e1c7a4f9-b3d2-48e6-a9f1-5c0b7e2d3a81 ,jimena_cruz ,"Nothing to complain about, but also nothing wow. Just a standard tool.",3,0,2016-05-16 02:51:00,Thanks for the review. We aim to keep things simple and reliable — glad it's meeting expectations.,2023-10-28 13:36:00,Unknown,en,us,1,2016
4a9e2d1c-f7b8-43c5-8e0f-1d6a9c3b7f52 ,tomas_herrera ,"It works as expected. Interface is simple, which is fine for me.",3,0,2016-05-14 23:27:00,Glad the simple interface works for you. Thanks for the feedback!,2023-10-28 13:33:00,Unknown,en,us,1,2016
b2f8e6d3-a1c9-4e7a-9f5b-0c4d3e1a8b69 ,alondra_m_ ,"Not the best I've tried, but it does the basics without too many issues.",3,0,2016-12-05 21:18:00,Appreciate it. We're constantly tweaking things to make the experience smoother.,2023-10-28 13:30:00,Unknown,en,us,1,2016
8d3c7a1f-e5b2-42d9-a6f0-9e1b5c3d7a34 ,benjamin_18 ,Okay experience so far. Loads reasonably fast and doesn't crash often.,4,0,2016-10-05 18:55:00,Thanks for letting us know. Performance is a priority — more optimizations coming.,2023-10-28 13:27:00,Unknown,en,us,1,2016
1f6a9e4c-d8c3-47b1-9e8d-3a0f2b7c5e81 ,catalina_vidal ,"Middling app. Some parts are convenient, others could be improved.",1,0,2016-08-05 16:32:00,Thank you for the balanced take. Your input helps us decide what to improve next.,2023-10-26 16:50:00,Unknown,en,us,1,2016
d7e2c5a9-f1b8-4a3e-8c9f-6b4d1e0a7f26 ,ignacio_lopez ,"It's alright. I keep it installed, but I don't use it every day.",3,0,2016-06-05 14:09:00,Nice to hear you keep it installed. We'll keep working to make it more useful day-to-day.,2023-10-24 14:27:00,Unknown,en,us,1,2016
5b9f3d2e-c7a1-48e4-a0b9-2c5e8d1f6a73 ,melany_23 ,"Does the job for what I need. No major problems, no major praise.",3,0,2016-04-05 11:44:00,Thanks for the review! Happy it handles the basics without issues for you.,2023-10-22 11:04:00,Unknown,en,us,1,2016
a8c4e1f7-d9b2-43a6-9f0e-1d7b3c5a8e49 ,cristian_94 ,"Pretty standard. Nothing stands out, but it hasn't let me down yet.",3,0,2016-02-05 09:21:00,"Appreciate the feedback. We’re focused on steady improvements — nothing flashy, just reliable.",2023-05-25 16:33:00,Unknown,en,us,1,2016
3e7d2a9c-f6b1-4c8e-a5f3-0b9c6e1d7a58 ,valery_ortega ,"Functional enough. A few minor bugs here and there, but manageable.",4,0,2016-04-30 06:58:00,Thank you. Those minor bugs are on our radar for the next patch.,2023-05-01 21:41:00,Unknown,en,us,1,2016
f4a1c8e6-b3d9-47e2-9c0a-5d2f8b1e3c67 ,oscar_mtz ,"Neutral feelings. It's there when I need it, and that's about it.",2,0,2016-04-28 04:13:00,Thanks for sharing your thoughts. We value users who stick around and give honest input.,2022-12-28 17:08:00,Unknown,en,us,1,2016
9d6b3f1a-e2c7-41d9-8f4b-0a7e5c2d9f81 ,nayeli_07 ,"Not terrible, not amazing. Just an ordinary app in its category.",3,0,2016-04-26 01:47:00,Glad it's acceptable for you. We're always refining based on feedback like this.,2018-11-27 09:55:00,Unknown,en,us,1,2016
2c8e5d9f-a1b3-48c7-b9e0-6f3a1d7c4e26 ,rafael_2002 ,"Works without drama. Could be smoother, but it's acceptable.",3,0,2016-04-24 23:19:00,Thanks! We're working on making everything run a bit smoother — stay tuned.,2018-09-09 21:36:00,Unknown,en,us,1,2016
e9f3a7c2-d8e1-4b5a-9c0f-1d4b8e2a7f53 ,karla_ferreira ,Fairly average. I use it from time to time and it serves its purpose.,3,0,2016-04-22 20:41:00,Appreciate the neutral review. It serves its purpose for many — thanks for keeping it installed.,2018-07-09 19:12:00,Unknown,en,us,1,2016
